{
  "artifact": {
    "approval_requirements": [],
    "blocking_issues": [
      "Error rate exceeded the allowed production threshold."
    ],
    "budget_class": "medium",
    "created_at": "2026-04-22T15:54:53Z",
    "execution_lane": "guarded",
    "id": "pr-spec-anthropic-2026-04-20-april-20-2026-25307862",
    "model_fingerprint": "sre_sentinel.v1",
    "next_stage": "feedback_synthesis",
    "owner_agent": "SRE Sentinel",
    "policy_decision_id": "policy-anthropic-2026-04-20-april-20-2026-25307862",
    "risk_tier": "medium",
    "rollback_class": "reversible_deploy",
    "source_stage": "build",
    "status": "blocked",
    "updated_at": "2026-04-22T21:00:08Z",
    "version": 6
  },
  "branch_name": "factory/support-response-format-tool-mode-for-tool-resul",
  "changed_paths": [
    "integrations/anthropic/contracts.py",
    "tests/contracts/test_anthropic_contracts.py",
    "integrations/anthropic/tool_runtime.py",
    "tests/integration/test_anthropic_tool_runtime.py"
  ],
  "checks": [
    {
      "name": "Lint",
      "status": "passed"
    },
    {
      "name": "Typecheck",
      "status": "passed"
    },
    {
      "name": "Unit tests",
      "status": "passed"
    },
    {
      "name": "Contract validation",
      "status": "passed"
    },
    {
      "name": "Integration tests",
      "status": "passed"
    },
    {
      "name": "Migration safety checks",
      "status": "passed"
    },
    {
      "name": "Targeted regression suite",
      "status": "passed"
    },
    {
      "name": "Latency benchmark",
      "status": "passed"
    },
    {
      "name": "Cost benchmark",
      "status": "passed"
    },
    {
      "name": "Adversarial prompt suite",
      "status": "pending"
    },
    {
      "name": "Long-running integration suite",
      "status": "pending"
    },
    {
      "name": "Full golden-dataset quality suite",
      "status": "pending"
    },
    {
      "name": "Canary error-rate check",
      "status": "pending"
    },
    {
      "name": "Canary latency check",
      "status": "pending"
    },
    {
      "name": "Canary cost check",
      "status": "pending"
    },
    {
      "name": "Rollback probe",
      "status": "pending"
    }
  ],
  "eval_manifest_id": "eval-spec-anthropic-2026-04-20-april-20-2026-25307862",
  "merge_readiness": {
    "reviewable": false,
    "mergeable": false,
    "blockers": [
      "Error rate exceeded the allowed production threshold."
    ]
  },
  "pull_request": {
    "number": null,
    "repository": "mindsdb/platform",
    "title": "Implement Support response format tool mode for tool results",
    "url": null
  },
  "reviewer_report": {
    "approved": false,
    "blocking_findings": [
      "Error rate exceeded the allowed production threshold."
    ],
    "non_blocking_findings": [
      "Carry open question: Do any existing Anthropic wrappers need compatibility shims before this change can ship?",
      "Deferred eval tiers after merge: nightly, post_deploy.",
      "Context assembly keeps validation and permission guardrails in place.",
      "Security review approved.",
      "Traffic mode in effect: canary.",
      "Production dashboards should stay pinned during the initial rollout window.",
      "Release manager promoted the feature after staging soak.",
      "Production rollout mode remains canary.",
      "Alert routing keeps the lead engineer first and the core builder second.",
      "Autonomous mitigation succeeded; keep dashboards pinned until the feature is stable again.",
      "The feature flag was disabled to stop the regression path.",
      "No alert thresholds fired during this production monitoring window.",
      "No production mitigation was needed.",
      "SRE Sentinel observed stable production metrics after a prior incident, but the incident follow-up remains open."
    ]
  },
  "spec_packet_id": "spec-anthropic-2026-04-20-april-20-2026-25307862",
  "summary": {
    "key_risks": [
      "Legacy callers should receive a deterministic contract error for unsupported request shapes.",
      "Tool/schema mismatches must fail closed instead of running with partial permissions."
    ],
    "migrations": [],
    "rollback_notes": "Disable rollout traffic, revert the deploy, and preserve compatibility fallbacks.",
    "what_changed": [
      "Implement Support response format tool mode for tool results: contract compatibility with scope anchored on Update request and response contracts with compatibility-safe fallbacks",
      "Implement Support response format tool mode for tool results: runtime integration wiring with scope anchored on Wire tool/runtime integration, schema handling, and retry-safe execution behavior"
    ]
  },
  "ticket_ids": [
    "ticket-spec-anthropic-2026-04-20-april-20-2026-25307862-cont",
    "ticket-spec-anthropic-2026-04-20-april-20-2026-25307862-inte"
  ]
}
